GOOG,Alphabet Inc,20181210,GRAPHIC-Deep losses leave Big Tech with small earnings multiples ,SAN FRANCISCO  Dec 10 Deep losses in Amazon Inc   Apple Inc  Facebook Inc and Alphabet Inc have left the former tech favorites at their lowest earnings multiples in years  offering potential bargains to cold-blooded investors looking to buy stocks at a time of heightened fear.,normal
GOOG,Alphabet Inc,20181210,Australian watchdog wants a regulator for dominant Google  Facebook ,SYDNEY Australia's competition watchdog on Monday recommended tougher scrutiny and a new regulatory body to check the dominance of tech giants Facebook Inc and Alphabet Inc's Google in the country's online advertising and news markets.,normal
GOOG,Alphabet Inc,20181210,UPDATE 3-Australian watchdog wants a regulator for dominant Google  Facebook ,* ACCC says Facebook  Google dominate online ad and news display,normal
GOOG,Alphabet Inc,20181205,Waymo unveils self-driving taxi service in Arizona for paying customers ,CHANDLER  Ariz. Alphabet's  Waymo on Wednesday launched a significant development in its costly  decade-long quest for autonomous transportation: self-driving taxis that actually generate fares. | Video ,topStory
GOOG,Alphabet Inc,20181205,FOCUS-Waymo unveils self-driving taxi service in Arizona for paying customers ,CHANDLER  Ariz.  Dec 5 Alphabet's Waymo on Wednesday launched a significant development in its costly  decade-long quest for autonomous transportation: self-driving taxis that actually generate fares.,normal
GOOG,Alphabet Inc,20181204,Alphabet's Wing drone delivery business to take flight in Finland ,Google parent Alphabet Inc's drone delivery business Wing will launch its first European delivery service in Finland in the spring of 2019  it said in a statement on Tuesday.,topStory
GOOG,Alphabet Inc,20181204,Alphabet's Wing drone delivery business to take flight in Finland ,Dec 4 Google parent Alphabet Inc's drone delivery business Wing will launch its first European delivery service in Finland in the spring of 2019  it said in a statement on Tuesday.,normal
GOOG,Alphabet Inc,20181202,Google CEO hearing in U.S. House likely to be postponed: Goodlatte ,WASHINGTON The U.S. House Judiciary Committee will likely put off until next week a hearing with Google Chief Executive Sundar Pichai on the Alphabet Inc  unit’s social media practices because of the state funeral of former President George H.W. Bush  Chairman Bob Goodlatte said on Sunday.,topStory
GOOG,Alphabet Inc,20181202,Google CEO hearing in U.S. House likely to be postponed -Goodlatte ,WASHINGTON  Dec 2 The U.S. House Judiciary Committee will likely put off until next week a hearing with Google Chief Executive Sundar Pichai on the Alphabet Inc unit’s social media practices because of the state funeral of former President George H.W. Bush  Chairman Bob Goodlatte said on Sunday.,normal
GOOG,Alphabet Inc,20181130,Does Google harm local search rivals? EU antitrust regulators ask ,BRUSSELS EU antitrust regulators have asked Google's rivals if the internet search giant unfairly demotes local search competitors  according to a questionnaire seen by Reuters  a move which could lead to a fourth case against the Alphabet  unit.,topStory
GOOG,Alphabet Inc,20181129,Indonesia's Go-Jek starts trial launch in Singapore  challenges Grab ,SINGAPORE  Nov 29 Indonesian ride-hailing firm Go-Jek kicked off a trial launch in parts of Singapore on Thursday and plans to roll out an array of services through its app in early 2019  challenging dominant player Grab in the small city-state.,normal
GOOG,Alphabet Inc,20181128,U.S. House panel sets Google CEO hearing for December 5 ,WASHINGTON The U.S. House Judiciary Committee will hold a hearing with Google Chief Executive Sundar Pichai on the Alphabet Inc unit's social media practices on Dec. 5  the committee said on Wednesday.,topStory
GOOG,Alphabet Inc,20181128,Amazon launches machine learning chip  taking on Nvidia  Intel ,Nov 28 Amazon.com on Wednesday launched a microchip aimed at so-called machine learning  entering a market that both Intel Corp and Nvidia Corp are counting on to boost their earnings in the coming years.,normal
GOOG,Alphabet Inc,20181128,YouTube shifts to make new exclusive shows  movies free to users ,SAN FRANCISCO YouTube plans to make all future original programing available to users for free with advertising  as the video streaming unit of Alphabet Inc's Google  seeks a bigger audience for shows and movies that had mostly been restricted to paid subscribers.,normal
GOOG,Alphabet Inc,20181128,UPDATE 2-YouTube shifts to make new exclusive shows  movies free to users ,SAN FRANCISCO  Nov 27 YouTube plans to make all future original programming available to users for free with advertising  as the video streaming unit of Alphabet Inc's Google seeks a bigger audience for shows and movies that had mostly been restricted to paid subscribers.,normal
GOOG,Alphabet Inc,20181127,YouTube shifts to make new exclusive shows  movies free to users ,SAN FRANCISCO  Nov 27 YouTube plans to make all of its future original programming available to users for free with advertising  as the video streaming unit of Alphabet Inc's Google seeks a bigger audience for shows and movies that had mostly been restricted to its paid subscribers.,topStory
GOOG,Alphabet Inc,20181127,Google employees push to stop Project Dragonfly ,Nov 27 Eleven employees comprising engineers and managers at Alphabet Inc's Google published an open letter on Tuesday  demanding that the company end development of a censored search engine for Chinese users  escalating earlier protests against the secretive project.,normal
GOOG,Alphabet Inc,20181127,RPT-FOCUS-Fearful of bias  Google blocks gender-based pronouns from new AI tool ,SAN FRANCISCO  Nov 27 Alphabet Inc's Google in May introduced a slick feature for Gmail that automatically completes sentences for users as they type. Tap out "I love" and Gmail might propose "you" or "it.",normal
GOOG,Alphabet Inc,20181127,Fearful of bias  Google blocks gender-based pronouns from new AI tool ,SAN FRANCISCO Alphabet Inc's  Google in May introduced a slick feature for Gmail that automatically completes sentences for users as they type. Tap out "I love" and Gmail might propose "you" or "it." | Video ,normal
GOOG,Alphabet Inc,20181127,FOCUS-Fearful of bias  Google blocks gender-based pronouns from new AI tool ,SAN FRANCISCO  Nov 27 Alphabet Inc's Google in May introduced a slick feature for Gmail that automatically completes sentences for users as they type. Tap out "I love" and Gmail might propose "you" or "it.",normal
GOOG,Alphabet Inc,20181126,UPDATE 1-Logitech ends negotiations to acquire Plantronics ,Nov 25 Logitech International SA  a Swiss manufacturer of keyboards and webcams  has ended discussions to acquire Plantronics Inc  a U.S. maker of Bluetooth earpieces and gaming headsets  the companies said on Sunday.,normal
GOOG,Alphabet Inc,20181123,Exclusive: A10 Networks explores potential sale - sources ,A10 Networks Inc  a U.S. technology company whose software and hardware help keep networks and data centres secure  is exploring options that include a potential sale of the company  people familiar with the matter said on Friday.,normal
GOOG,Alphabet Inc,20181123,EXCLUSIVE-A10 Networks explores potential sale - sources ,Nov 23 A10 Networks Inc  a U.S. technology company whose software and hardware help keep networks and data centers secure  is exploring options that include a potential sale of the company  people familiar with the matter said on Friday.,normal
GOOG,Alphabet Inc,20181119,Google-Temasek study sees $240 bln Southeast Asia internet economy by 2025 ,SINGAPORE  Nov 19 Southeast Asia's internet economy is expected to exceed $240 billion by 2025  a joint study by Google and Temasek Holdings showed  a fifth more than previously estimated  as more consumers use their smartphones to go online.,normal
GOOG,Alphabet Inc,20181116,Alphabet unit halts glucose-detecting contact lens project ,Alphabet Inc's life sciences division Verily said on Friday that it was putting on hold one of its oldest and highest-profile projects  a smart contact lens designed to help monitor sugar levels.,topStory
GOOG,Alphabet Inc,20181116,UPDATE 2-Alphabet unit halts glucose-detecting contact lens project ,Nov 16 Alphabet Inc's life sciences division Verily said on Friday that it was putting on hold one of its oldest and highest-profile projects  a smart contact lens designed to help monitor sugar levels.,normal
GOOG,Alphabet Inc,20181116,Alphabet's Verily pauses project on glucose-sensing lens ,Nov 16 Alphabet Inc's Verily said on Friday it is pausing research on glucose-sensing lens  one of its earliest projects.,normal
GOOG,Alphabet Inc,20181116,BRIEF-Alphabet's Verily Ending Smart Contact Lens Program To Measure Glucose Levels For Diabetics ,* ALPHABET'S VERILY ENDING SMART CONTACT LENS PROGRAM TO MEASURE GLUCOSE LEVELS FOR DIABETICS,normal
GOOG,Alphabet Inc,20181115,UPDATE 3-Cisco beats as network gear demand rises  new bets pay off ,Nov 14 Cisco Systems Inc beat analysts' estimates for quarterly revenue and profit on Wednesday  as the network gear maker benefited from demand for its routers and switches as well as growth in newer areas of focus such as software.,normal
GOOG,Alphabet Inc,20181108,Google hears protesters  changes sexual harassment policies ,Nov 8 Alphabet Inc's Google said on Thursday it would make changes to how it handles sexual harassment claims  a week after thousands of its employees around the world walked off their jobs to protest its response to such issues.,topStory
GOOG,Alphabet Inc,20181108,Google plans to expand office space in New York City: WSJ ,Alphabet Inc's  Google is nearing a deal to buy or lease an office building in New York City that could add space for more than 12 000 new workers  The Wall Street Journal reported on Wednesday  citing sources.,normal
GOOG,Alphabet Inc,20181108,Google plans to expand office space in New York City - WSJ ,Nov 7 Alphabet Inc's Google is nearing a deal to buy or lease an office building in New York City that could add space for more than 12 000 new workers  The Wall Street Journal reported https://on.wsj.com/2JLvhmZ on Wednesday  citing sources.,normal
GOOG,Alphabet Inc,20181107,Trump would consider regulating social media but urges caution ,WASHINGTON U.S. President Donald Trump said he would consider working with Democrats to regulate social media companies  after he and other conservatives accused companies such as Twitter Inc  Facebook Inc and Alphabet Inc's Google of allegedly stifling right wing views.,topStory
GOOG,Alphabet Inc,20181107,UPDATE 1-Trump would consider regulating social media but urges caution ,WASHINGTON  Nov 7 U.S. President Donald Trump said he would consider working with Democrats to regulate social media companies  after he and other conservatives accused companies such as Twitter Inc  Facebook Inc and Alphabet Inc's Google of allegedly stifling right wing views.,normal
GOOG,Alphabet Inc,20181107,EU's Vestager says probe into Google AdSense case nearing end ,LISBON EU regulators are close to wrapping up their third case against Alphabet  unit Google involving its AdSense advertising service  Europe's antitrust chief said on Wednesday  suggesting the company may soon be hit with another hefty fine.,normal
GOOG,Alphabet Inc,20181107,Intel-drafted U.S. data privacy bill would protect firms from fines ,Chipmaker Intel Corp  said it is seeking a sponsor in Congress for a U.S. data privacy bill it drafted that would shield companies from fines if they attest to the U.S. Federal Trade Commission annually that they take strong measures to protect consumer data.,normal
GOOG,Alphabet Inc,20181106,UPDATE 1-Judges named to hear government's appeal of AT&T Time Warner deal approval ,WASHINGTON  Nov 6 A panel of three federal appeals court judges named by former Presidents Ronald Reagan  Bill Clinton and Barack Obama will hear the Justice Department's appeal of a ruling allowing AT&T Inc to acquire Time Warner  court records show.,normal
GOOG,Alphabet Inc,20181105,RPT-FOCUS-Vying for Vuitton: China's e-commerce rivals seek luxury stranglehold ,PARIS  Nov 5 China's online giants Alibaba and JD.com are taking their battle for relevance in the lucrative luxury goods market to a new level  as they aim to crack e-commerce tie-ups with top brands that usually shun selling through third parties.,normal
GOOG,Alphabet Inc,20181102,Google's top U.S. public policy official leaving post ,WASHINGTON  Nov 2 Alphabet Inc's Google unit said on Friday that its Washington office chief  who also heads Americas policy  is stepping down as the company faces criticism on issues including how it protects users' privacy and its investment plans in China.,topStory
GOOG,Alphabet Inc,20181102,Apple loses $1 trillion status after soft holiday forecast ,Nov 2 Shares in Apple Inc fell 6 percent on Friday  cutting its market value back to less than $1 trillion after it forecast softer-than-expected sales for the holiday quarter and fueled nerves over iPhone sales by saying it would no longer release the figures.,normal
GOOG,Alphabet Inc,20181030,Waymo gets California OK to test driverless vehicles without backup driver ,WASHINGTON  Oct 30 Alphabet Inc's Waymo unit on Tuesday became the first company to receive a permit from the state of California to test driverless vehicles without a backup driver in the front seat  the state's Department of Motor Vehicles said.,topStory
GOOG,Alphabet Inc,20181026,Weak Amazon  Alphabet results ignite growth worries ,Shares of Amazon.com Inc  dropped by the most in four years on Friday after its outlook for holiday season sales missed targets  fanning concerns that Wall Street's tech darlings are finally starting to face stronger competition. | Video ,topStory
GOOG,Alphabet Inc,20181026,US STOCKS-Wall St falls after earnings disappointments  but off day's lows ,* Indexes: Dow down 1.3 pct  S&P down 2 pct  Nasdaq down 2.3 pct (Updates to late afternoon),normal
GOOG,Alphabet Inc,20181026,UPDATE 2-Weak Amazon  Alphabet results ignite growth worries ,Oct 26 Shares of Amazon.com Inc dropped by the most in four years on Friday after its outlook for holiday season sales missed targets  fanning concerns that Wall Street's tech darlings are finally starting to face stronger competition.,normal
GOOG,Alphabet Inc,20181026,US STOCKS-Wall St off session lows as Alphabet pares losses ,* S&P down 0.87 pct  but off correction levels (Updates prices to afternoon),normal
GOOG,Alphabet Inc,20181026,US STOCKS-Wall Street resumes selloff; S&P flirts with correction ,* S&P over 10 pct below closing high  threatening correction (Changes comment  updates prices to late morning),normal
GOOG,Alphabet Inc,20181026,US STOCKS-Wall St sinks as Amazon  Alphabet earnings spark growth concerns ,* Indexes down: Dow 1.10 pct  S&P 1.56 pct  Nasdaq 1.98 pct (Updates prices to open),normal
GOOG,Alphabet Inc,20181026,US STOCKS-Futures cut losses as healthy GDP growth dulls pain of corporate slowdown ,* Futures down: Dow 0.72 pct  S&P 0.90 pct  Nasdaq 1.77 pct (Changes comments  updates prices),normal
GOOG,Alphabet Inc,20181026,US STOCKS-Futures sink as Amazon  Alphabet spark fresh selloff ahead of GDP data ,Oct 26 U.S. stock index futures plunged on Friday as disappointing results from behemoths Amazon and Alphabet rekindled a rush to dump technology and high-growth stocks  ahead of data that will likely show U.S. economic growth slowed last quarter.,normal
GOOG,Alphabet Inc,20181026,GLOBAL MARKETS-Asia stumbles again despite Wall St bounce amid growth  earnings fears ,* Euro falls after Draghi reaffirms end of asset purchase program,normal
GOOG,Alphabet Inc,20181026,GLOBAL MARKETS-Asian shares struggle to shake off rout despite Wall St bounce ,* Euro falls after Draghi reaffirms end of asset purchase program,normal
GOOG,Alphabet Inc,20181025,Alphabet misses Wall Street revenue estimates; shares fall ,Google parent Alphabet Inc  on Thursday missed analysts' quarterly revenue estimates for the first time in at least two years and reported continuing erosion of its operating margin  sending shares down almost 7 percent after hours. | Video ,topStory
GOOG,Alphabet Inc,20181025,UPDATE 4-Amazon's holiday season sales outlook misses views; shares sink ,Oct 25 Amazon.com Inc forecast holiday season sales and profit that missed Wall Street targets on Thursday  projecting revenue growth that would be the slowest in years  sending shares of the world's largest online retailer down 8 percent in after-hours trade.,normal
GOOG,Alphabet Inc,20181025,UPDATE 3-Alphabet misses Wall Street revenue estimates; shares fall ,Oct 25 Google parent Alphabet Inc on Thursday missed analysts' quarterly revenue estimates for the first time in at least two years and reported continuing erosion of its operating margin  sending shares down almost 7 percent after hours.,normal
GOOG,Alphabet Inc,20181025,Alphabet's 3rd-qtr profit beats estimates ,Oct 25 Alphabet Inc beat Wall Street estimates for third-quarter profit on Thursday  as the search engine giant's revenue from online advertisements soared.,normal
GOOG,Alphabet Inc,20181024,Google  Facebook executives meet with UK government over no-deal Brexit - Telegraph ,The UK chiefs of Microsoft Corp   Facebook  and Alphabet Inc's  Google met with British government ministers in London on Wednesday to seek assurances over the impact of a no-deal Brexit on jobs and investment  the Telegraph reported on Wednesday.,topStory
GOOG,Alphabet Inc,20181024,Google  Facebook executives meet with UK government over no-deal Brexit: Telegraph ,The UK chiefs of Microsoft Corp   Facebook  and Alphabet Inc's  Google met with British government ministers in London on Wednesday to seek assurances over the impact of a no-deal Brexit on jobs and investment  the Telegraph reported on Wednesday.,normal
GOOG,Alphabet Inc,20181024,UPDATE 1-Google  Facebook execs meet with UK govt over no-deal Brexit-Telegraph ,Oct 24 The UK chiefs of Microsoft Corp  Facebook and Alphabet Inc's Google met with British government ministers in London on Wednesday to seek assurances over the impact of a no-deal Brexit on jobs and investment  the Telegraph reported on Wednesday.,normal
GOOG,Alphabet Inc,20181024,U.S. tech funds turn to Visa  Paypal as FANGs fade ,NEW YORK Some tech-heavy U.S. fund managers have turned to the once-stodgy payments sector as an alternative to so-called FANG stocks as high-flyers like Facebook Inc  and Google parent Alphabet Inc  falter.,normal
GOOG,Alphabet Inc,20181024,U.S. tech funds turn to Visa  Paypal as FANGs fade ,NEW YORK  Oct 24 Some tech-heavy U.S. fund managers have turned to the once-stodgy payments sector as an alternative to so-called FANG stocks as high-flyers like Facebook Inc and Google parent Alphabet Inc falter.,normal
GOOG,Alphabet Inc,20181024,Senators question Google's tardy disclosure of user data exposure ,WASHINGTON Two U.S. senators said Alphabet Inc's  disclosure of user data vulnerabilities at Google+ raised "serious questions" over whether it violated a 2011 consent decree with the Federal Trade Commission  potentially exposing Google to penalties.,normal
GOOG,Alphabet Inc,20181024,UPDATE 1-U.S. senators question Google's tardy disclosure of user data exposure ,WASHINGTON  Oct 24 Two U.S. senators said Alphabet Inc's disclosure of user data vulnerabilities at Google+ raised "serious questions" over whether it violated a 2011 consent decree with the Federal Trade Commission  potentially exposing Google to penalties.,normal
GOOG,Alphabet Inc,20181024,Two Democrats say Google+ data exposure may violate FTC consent decree ,WASHINGTON  Oct 24 Two U.S. senators said Alphabet Inc's disclosure that private profile data of at least 500 000 users of Google+ may have been exposed to hundreds of external developers raises "serious questions" about whether the company violated a 2011 consent decree with the Federal Trade Commission.,normal
GOOG,Alphabet Inc,20181024,PRESS DIGEST-New York Times business news - Oct 24 ,Oct 24 The following are the top stories on the New York Times business pages. Reuters has not verified these stories and does not vouch for their accuracy.,normal
GOOG,Alphabet Inc,20181023,CORRECTED-Web performance software company Cloudflare readies IPO -sources ,Oct 23 Cloudflare Inc  a U.S. startup whose software makes websites load faster and with greater security  is preparing for an initial public offering (IPO) that could value it at more than $3.5 billion  people familiar with the matter said.,normal
GOOG,Alphabet Inc,20181022,Aptoide wins court battle against Google in landmark case ,LISBON Portuguese app store Aptoide said on Monday that a local court had ruled against Alphabet Inc's Google  in a landmark case  ordering the U.S. giant to stop removing its app from users' mobile phones without their knowledge.,topStory
GOOG,Alphabet Inc,20181022,UPDATE 1-Aptoide wins court battle against Google in landmark case ,LISBON  Oct 22 Portuguese app store Aptoide said on Monday that a local court had ruled against Alphabet Inc's Google in a landmark case  ordering the U.S. giant to stop removing its app from users' mobile phones without their knowledge.,normal
GOOG,Alphabet Inc,20181022,Portugal's Aptoide says wins first court ruling against Google ,LISBON  Oct 22 Portuguese app store Aptoide said on Monday a local court has ruled against Alphabet Inc's Google  ordering it to stop removing Aptoide's app from users' mobile phones without their knowledge in a landmark case.,normal
GOOG,Alphabet Inc,20181020,Google to charge Android partners up to $40 per device for apps: source , (This Oct. 19 story has been refiled to fix wording in fourth paragraph),topStory
GOOG,Alphabet Inc,20181020,REFILE-UPDATE 1-Google to charge Android partners up to $40 per device for apps -source ,BRUSSELS/SAN FRANCISCO  Oct 19 Alphabet Inc's Google will charge hardware firms up to $40 per device to use its apps under a new licensing system to replace one that the European Union this year deemed anti-competitive  a person familiar with the matter said on Friday.,normal
GOOG,Alphabet Inc,20181019,Google to charge Android partners up to $40 per device for apps - source ,BRUSSELS/SAN FRANCISCO  Oct 19 Alphabet Inc's Google will charge hardware firms up to $40 per device to use its apps under a new licensing system to replace one that the European Union this year deemed anti-competitive  a person familiar with the matter said on Friday.,topStory
GOOG,Alphabet Inc,20181019,Wall St Week Ahead-With market on edge  investors look to tech trio ,SAN FRANCISCO  Oct 19 The pressure is on for Amazon  Alphabet and Microsoft as they prepare to report quarterly results at a time when confidence in those market leaders looks increasingly fragile and in danger of derailing Wall Street's rally.,normal
GOOG,Alphabet Inc,20181018,JD.com spies profits in China's giant parcel delivery market ,SHANGHAI  Oct 18 Chinese e-commerce firm JD.com Inc said on Thursday it was launching a parcel delivery business  a move which could help the firm leverage its network of warehouses and drivers to bolster flagging profits.,normal
GOOG,Alphabet Inc,20181016,Google to charge smartphone makers for Google Play in Europe ,BRUSSELS  Oct 16 U.S. tech giant Google will charge smartphone makers a licensing fee for using its popular Google Play app store and also allow them to use rival versions of its Android mobile operating system to comply with an EU antitrust order.,topStory
GOOG,Alphabet Inc,20181016,Google latest to withdraw from Saudi conference ,Alphabet Inc's Google on Monday became the latest company to drop out of a business conference in Saudi Arabia.,normal
GOOG,Alphabet Inc,20181016,UPDATE 1-Google latest to withdraw from Saudi conference ,Oct 15 Alphabet Inc's Google on Monday became the latest company to drop out of a business conference in Saudi Arabia.,normal
GOOG,Alphabet Inc,20181012,Google tells U.S. lawmakers it is mulling options on China services ,WASHINGTON Alphabet Inc's  Google unit has told U.S. lawmakers it was considering "a variety of options" to offer additional services in China  but declined to detail plans for addressing Chinese censorship.,topStory
GOOG,Alphabet Inc,20181012,UPDATE 1-Google tells U.S. lawmakers it is mulling options on China services ,WASHINGTON  Oct 12 Alphabet Inc's Google unit has told U.S. lawmakers it was considering "a variety of options" to offer additional services in China  but declined to detail plans for addressing Chinese censorship.,normal
GOOG,Alphabet Inc,20181012,Google tells U.S. lawmakers it is mulling options on China services ,WASHINGTON  Oct 12 Alphabet Inc's Google unit has told U.S. lawmakers it is considering "a variety of options" for offering additional services in China.,normal
GOOG,Alphabet Inc,20181009,Alphabet to shut Google+ social site after user data exposed , (This version of the October 8 story corrects to "consulting and accounting firm" from "legal firm" in paragraph 8) | Video ,topStory
GOOG,Alphabet Inc,20181009,UPDATE 3-Google unveils new Pixel phone  adds tablet in Apple challenge ,SAN FRANCISCO  Oct 9 Alphabet Inc's Google on Tuesday unveiled the third edition of its Pixel smartphone  a Google Home smart speaker with a display and its first tablet computer as it makes a come-from-behind push into hardware.,normal
GOOG,Alphabet Inc,20181009,CORRECTED-UPDATE 4-Alphabet to shut Google+ social site after user data exposed ,Oct 8 Alphabet Inc's Google will shut down the consumer version of its failed social network Google+ and tighten its data sharing policies after announcing on Monday that private profile data of at least 500 000 users may have been exposed to hundreds of external developers.,normal
