GOOG,Alphabet Inc,20180709,House Republicans query Apple  Alphabet on privacy  data practices ,Four senior U.S. House Republicans sent letters on Monday to the chief executives of Apple Inc  and Google parent Alphabet Inc  asking questions about location data and mobile phone privacy practices and the handling of customer data.,normal
GOOG,Alphabet Inc,20180709,Uber  Alphabet invest in bike sharing service Lime ,July 9 Bike sharing service Lime said on Monday it raised $335 million from a group of investors including ride-sharing firm Uber Technologies Inc and Alphabet Inc.,normal
GOOG,Alphabet Inc,20180709,UPDATE 1-U.S. House Republicans query Apple  Alphabet on privacy  data practices ,July 9 Four senior U.S. House Republicans sent letters on Monday to the chief executives of Apple Inc and Google parent Alphabet Inc asking questions about location data and mobile phone privacy practices and the handling of customer data.,normal
GOOG,Alphabet Inc,20180709,House Republicans demand answers from Apple  Alphabet on privacy  data practices ,July 9 Four senior U.S. House Republicans sent letters on Monday to the chief executives of Apple Inc and Google parent Alphabet Inc asking questions about location data and mobile phone privacy practices and the handling of customer data.,normal
GOOG,Alphabet Inc,20180704,Chile's Pinera to meet CEOs of Amazon  Alphabet next week ,Santiago Chilean President Sebastian Pinera said on Tuesday that he plans to meet with the chief executives of Amazon.com Inc and Alphabet Inc next week to enlist their support for helping the South American nation make technological progress.,topStory
GOOG,Alphabet Inc,20180704,Chile's Pinera to meet CEOs of Amazon  Alphabet next week ,Santiago  July 3 Chilean President Sebastian Pinera said on Tuesday that he plans to meet with the chief executives of Amazon.com Inc and Alphabet Inc next week to enlist their support for helping the South American nation make technological progress.,normal
GOOG,Alphabet Inc,20180628,California lawmakers approve data-privacy bill opposed by Silicon Valley ,SAN FRANCISCO  June 28 California state lawmakers on Thursday unanimously passed a data privacy bill aimed at giving consumers more control over how companies collect and manage their personal information  a bill that Google parent Alphabet Inc and other big companies have opposed.,topStory
GOOG,Alphabet Inc,20180626,Audi partners with Israel's autonomous vehicle simulation startup Cognata ,June 26 German carmaker Audi AG has partnered with autonomous vehicle simulation platform provider Cognata Ltd to speed up the development of autonomous vehicles  the Israel-based startup said on Tuesday.,normal
GOOG,Alphabet Inc,20180621,U.S. lawmakers want Google to reconsider links to China's Huawei ,WASHINGTON Some Republican and Democratic U.S. lawmakers asked Alphabet Inc's  Google on Wednesday to reconsider its work with Chinese telecommunications firm Huawei Technologies Co Ltd  which they described as a security threat.,topStory
GOOG,Alphabet Inc,20180621,YouTube pushes memberships  merchandise as alternatives to ads ,SAN FRANCISCO  June 21 YouTube said on Thursday that video uploaders with more than 100 000 followers could start paid fan clubs on the service  one of several new features aimed at helping itself and its users diversify revenue after a turbulent year.,normal
GOOG,Alphabet Inc,20180620,UPDATE 1-U.S. lawmakers want Google to reconsider links to China's Huawei ,WASHINGTON  June 20 Some Republican and Democratic U.S. lawmakers asked Alphabet Inc's Google on Wednesday to reconsider its work with Chinese telecommunications firm Huawei Technologies Co Ltd  which they described as a security threat.,topStory
GOOG,Alphabet Inc,20180620,What trade war? FAANGs scale new highs ,Four of the five so-called FAANG stocks – Facebook  Alphabet  Amazon and Netflix – surged to all-time highs on Wednesday  with only Apple spoiling a perfect scorecard.,normal
GOOG,Alphabet Inc,20180620,What trade war? FAANGs scale new highs ,June 20 Four of the five so-called FAANG stocks – Facebook  Alphabet  Amazon and Netflix – surged to all-time highs on Wednesday  with only Apple spoiling a perfect scorecard.,normal
GOOG,Alphabet Inc,20180620,U.S. lawmakers want Google to reconsider links to China's Huawei ,WASHINGTON  June 20 A group of Republican and Democratic U.S. lawmakers asked Alphabet Inc's Google on Wednesday to reconsider its work with Chinese telecommunications firm Huawei Technologies Co Ltd  which they described as a security threat.,normal
GOOG,Alphabet Inc,20180612,Chinese truckers demonstrate over high fuel costs  truck-hailing app Manbang ,SHANGHAI/BEIJING  June 12 Chinese truck drivers are demonstrating against higher fuel costs and the dominance of local truck hire platform Manbang which they said is squeezing incomes  a potential headache for the firm backed by SoftBank Group Corp and Alphabet Inc.,topStory
GOOG,Alphabet Inc,20180607,Google bars uses of its artificial intelligence tech in weapons ,SAN FRANCISCO  June 7 Google will not allow its artificial intelligence software to be used in weapons or unreasonable surveillance efforts  the Alphabet Inc unit said Thursday in standards for its business decisions in the nascent field.,topStory
GOOG,Alphabet Inc,20180607,U.S. senator questions Alphabet  Twitter on Huawei relationship ,WASHINGTON  June 7 A U.S. senator on Thursday is seeking responses from Google parent Alphabet Inc and Twitter Inc on whether the U.S. companies have any data sharing agreements with Chinese vendors  following a disclosure from Facebook Inc this week.,normal
GOOG,Alphabet Inc,20180607,Alphabet's Waymo hopes to bring robo-taxi service to Europe ,TURIN  Italy Alphabet Inc's self-driving unit Waymo wants to bring its robo-taxi service to Europe after it launches in the United States later this year.,normal
GOOG,Alphabet Inc,20180607,Alphabet's Waymo hopes to bring robo-taxi service to Europe ,TURIN  Italy  June 7 Alphabet Inc's self-driving unit Waymo wants to bring its robo-taxi service to Europe after it launches in the United States later this year.,normal
GOOG,Alphabet Inc,20180607,Norway's wealth fund backs content controversy motion at Alphabet ,OSLO  June 7 Norway's $1 trillion wealth fund backed activist shareholders' attempt to force Google parent Alphabet Inc to report openly on global content controversies  voting records showed on Thursday.,normal
GOOG,Alphabet Inc,20180606,UPDATE 1-Alphabet shareholders reject diversity proposal backed by employees ,MOUNTAIN VIEW  Calif.  June 6 Alphabet Inc's shareholders  including top executives  voted down several proposals on Wednesday  defeating campaigns to tie pay to diversity goals and to get the Google parent to provide more data about efforts to moderate user-generated content.,topStory
GOOG,Alphabet Inc,20180606,Alphabet's stockholders vote against gender pay gap  diversity proposals ,June 6 Alphabet Inc's top executives voted down several shareholder proposals on Wednesday  defeating campaigns to tie their pay to hiring diversity goals and to get the Google parent to provide more data about efforts to moderate user-generated content.,normal
GOOG,Alphabet Inc,20180604,Washington state sues Facebook  Google over election ad disclosure ,SAN FRANCISCO The state of Washington said on Monday it had sued Facebook Inc  and Alphabet Inc's  Google for allegedly violating state campaign finance law by failing to maintain information about who buys election ads.,topStory
GOOG,Alphabet Inc,20180601,RPT-FOCUS-Google's 'Reserve' tool winning converts  taking search to next level ,SAN FRANCISCO  June 1 Alphabet Inc's Google is drawing thousands of new customers to gyms and salons each month through an appointment-booking tool released last year  Reuters has learned  a quiet step in the company's transition to the next generation of search.,topStory
GOOG,Alphabet Inc,20180601,Google's 'Reserve' tool winning converts  taking search to next level ,SAN FRANCISCO Alphabet Inc's Google  is drawing thousands of new customers to gyms and salons each month through an appointment-booking tool released last year  Reuters has learned  a quiet step in the company's transition to the next generation of search. | Video ,normal
GOOG,Alphabet Inc,20180601,FOCUS-Google's 'Reserve' tool winning converts  taking search to next level ,SAN FRANCISCO  June 1 Alphabet Inc's Google is drawing thousands of new customers to gyms and salons each month through an appointment-booking tool released last year  Reuters has learned  a quiet step in the company's transition to the next generation of search.,normal
GOOG,Alphabet Inc,20180531,Google launches second app in China  woos top smartphone market ,BEIJING Alphabet Inc's  Google has launched a file managing tool in several Chinese app stores as it looks for fresh inroads into the world's biggest smartphone market  where most of the internet giant's top products remain banned.,topStory
GOOG,Alphabet Inc,20180531,Google launches 2nd app in China  woos top smartphone market ,BEIJING  May 31 Alphabet Inc's Google has launched a file managing tool in several Chinese app stores as it looks for fresh inroads into the world's biggest smartphone market  where most of the internet giant's top products remain banned.,normal
GOOG,Alphabet Inc,20180522,Yelp seeks to revive EU antitrust complaint against Google ,SAN FRANCISCO Yelp Inc said on Tuesday it has renewed a European antitrust complaint against Alphabet Inc's Google  seeking to gain traction on a longstanding accusation that the search giant unfairly promotes its own services in results.,topStory
GOOG,Alphabet Inc,20180522,Yelp seeks to revive EU antitrust complaint against Google ,SAN FRANCISCO  May 22 Yelp Inc said on Tuesday it has renewed a European antitrust complaint against Alphabet Inc's Google  seeking to gain traction on a longstanding accusation that the search giant unfairly promotes its own services in results.,normal
GOOG,Alphabet Inc,20180516,Highlights: Hedge funds chomped on FAANGs during first quarter tech turmoil ,The following are some hot stocks including the so-called FAANG technology stocks - Facebook Inc   Amazon.com   Apple Inc   Netflix Inc  and Google parent Alphabet Inc  - as well as other companies in which hedge fund managers either took new stakes  adding to or exiting existing positions in the first quarter  filings with the U.S. Securities and Exchange Commission showed on Tuesday.,topStory
GOOG,Alphabet Inc,20180515,BRIEF-Tiger Global Dissolves Stake In Alphabet  Takes Stake in Twitter ,* REPORTS SHARE STAKE OF 200 000 CLASS A SHARES IN DROPBOX - SEC FILING,topStory
GOOG,Alphabet Inc,20180513,Tesla executive Schwall joins Alphabet's Waymo ,Alphabet Inc's self-driving unit  Waymo  said on Sunday that Matthew Schwall had joined the company from Tesla Inc where he was the electric carmaker's main technical contact with U.S. safety investigators.,topStory
GOOG,Alphabet Inc,20180513,UPDATE 1-Tesla executive Schwall joins Alphabet's Waymo ,May 13 Alphabet Inc's self-driving unit  Waymo  said on Sunday that Matthew Schwall had joined the company from Tesla Inc where he was the electric carmaker's main technical contact with U.S. safety investigators.,normal
GOOG,Alphabet Inc,20180513,Tesla executive Schwall leaves for Alphabet's Waymo - WSJ ,May 13 Tesla Inc's main technical contact with U.S. safety investigators  Matthew Schwall  has left the electric carmaker for Alphabet Inc's self-driving unit Waymo  the Wall Street Journal reported on Saturday  citing people familiar the decision.,normal
GOOG,Alphabet Inc,20180511,UPDATE 1-Cisco pulls all online ads from YouTube ,May 10 Network gear maker Cisco Systems Inc is pulling all online ads from YouTube due to fears of the ads appearing on sensitive content on the platform  Cisco's chief marketing officer  Karen Walker  said in a blog on Wednesday.,normal
GOOG,Alphabet Inc,20180509,Alphabet  Intel  FedEx  AT&T among drone pilot winners: universities ,WASHINGTON The Federal Aviation Administration on Wednesday is unveiling 10 pilot projects from counties  cities  states and universities that have been selected to help speed the use of unmanned aerial vehicles  or drones including many major corporate partners.,topStory
GOOG,Alphabet Inc,20180509,UPDATE 7-Walmart to pay $16 bln for control of India's Flipkart  shares slide ,NEW YORK/MUMBAI  May 9 Walmart Inc said on Wednesday it will pay $16 billion for a roughly 77 percent stake in Indian e-commerce firm Flipkart  the U.S. retailer's largest-ever deal as it competes with Amazon.com Inc in an important growth market.,normal
GOOG,Alphabet Inc,20180509,US STOCKS-Wall St surges on higher oil after U.S. quits Iran deal ,* Indexes end up: Dow 0.75 pct  S&P 0.97 pct  Nasdaq 1.00 pct (Updates to close),normal
GOOG,Alphabet Inc,20180509,Alphabet  Intel  FedEx  AT&T among drone pilot winners -universities ,WASHINGTON  May 9 The Federal Aviation Administration on Wednesday is unveiling 10 pilot projects from counties  cities  states and universities that have been selected to help speed the use of unmanned aerial vehicles  or drones including many major corporate partners.,normal
GOOG,Alphabet Inc,20180509,White House to hold artificial intelligence meeting with companies ,WASHINGTON The White House will convene a meeting on Thursday on the future of artificial intelligence in U.S. industry with major companies including Facebook Inc  Amazon.com Inc  Google parent Alphabet Inc and Oracle Corp as well as senior government officials.,normal
GOOG,Alphabet Inc,20180508,UPDATE 1-White House to hold artificial intelligence meeting with companies ,WASHINGTON  May 8 The White House will convene a meeting on Thursday on the future of artificial intelligence in U.S. industry with major companies including Facebook Inc   Amazon.com Inc  Google parent Alphabet Inc and Oracle Corp as well as senior government officials.,topStory
GOOG,Alphabet Inc,20180507,Google launches Android Things for appliances as earlier spinoffs scramble to catch on ,SAN FRANCISCO  May 7 Alphabet Inc's Google on Monday launched a spinoff of its Android operating system for home appliances and other machines  following mixed results with Android offshoots for cars  smartwatches and televisions.,normal
GOOG,Alphabet Inc,20180506,RPT-WRAPUP 3-Buffett craves more Apple shares  endorses its buybacks ,OMAHA  Neb.  May 5 Billionaire Warren Buffett has been buying a boatload of Apple Inc shares and on Saturday suggested he would buy even more shares at the right price.,normal
GOOG,Alphabet Inc,20180504,UPDATE 3-Flipkart yet to finalise stake sale deal with Walmart-sources ,* Flipkart board in-principle approves Walmart talks-source (Adds Amazon comment),normal
GOOG,Alphabet Inc,20180427,Alphabet's Sergey Brin says company must assume greater responsibility ,SAN FRANCISCO Alphabet Inc  President Sergey Brin said on Friday  that technology companies must take greater responsibility for the social impact of their work  his first comments following a year of heightened global awareness about misuse of digital services.,topStory
GOOG,Alphabet Inc,20180427,Alphabet's Sergey Brin says company must assume greater responsibility ,SAN FRANCISCO  April 27 Alphabet Inc President Sergey Brin said on Friday  that technology companies must take greater responsibility for the social impact of their work  his first comments following a year of heightened global awareness about misuse of digital services.,normal
GOOG,Alphabet Inc,20180427,BRIEF-Google CEO Sundar Pichai's 2017 Compensation Was $1.3 Mln ,* ALPHABET INC - ERIC SCHMIDT'S 2017 TOTAL COMPENSATION WAS $4.7 MILLION VERSUS $4.3 MILLION IN 2016 - SEC FILING,normal
GOOG,Alphabet Inc,20180426,ZTE tells suppliers China trade row may be factor in U.S. ban: source ,NEW YORK China's ZTE Corp  held a conference call on Wednesday with major suppliers  during which a company representative suggested the trade dispute with Beijing may have been a factor in last week's U.S. order banning American firms from selling goods to the smartphone maker  according to a person familiar with the call.,normal
GOOG,Alphabet Inc,20180426,REFILE-ZTE tells suppliers China trade row may be factor in U.S. ban - source ,NEW YORK  April 25 China's ZTE Corp held a conference call on Wednesday with major suppliers  during which a company representative suggested the trade dispute with Beijing may have been a factor in last week's U.S. order banning American firms from selling goods to the smartphone maker  according to a person familiar with the call.,normal
GOOG,Alphabet Inc,20180424,Google-owner Alphabet's shares fall on rise in costs ,Shares of Google parent Alphabet Inc lost more than 5 percent on Tuesday as a surge in costs drove what analysts said was its biggest ever contraction in gross margins  overshadowing strong first-quarter ad sales.,topStory
GOOG,Alphabet Inc,20180424,RPT-US STOCKS-Wall St slides as high bond yields fan cost worries ,* Dow down 1.74 pct  S&P 500 down 1.34 pct  Nasdaq down 1.7 pct,normal
GOOG,Alphabet Inc,20180424,US STOCKS-Wall St slides as high bond yields fan cost worries ,* Dow down 1.74 pct  S&P 500 down 1.34 pct  Nasdaq down 1.7 pct (Updates to market close; adds New York to dateline),normal
GOOG,Alphabet Inc,20180424,YouTube deletes 5 million videos for content violation ,SAN FRANCISCO YouTube  owned by Alphabet Inc's Google   deleted about 5 million videos from its platform for content policy violations in last year's fourth quarter before any viewers saw them  it said in a new report that highlighted its response to pressure to better police its online community.,normal
GOOG,Alphabet Inc,20180424,Softbank  Google join $1.9 billion investment in China truck-hailing firm ,BEIJING/SHANGHAI Japan's Softbank Group and Alphabet Inc's venture capital fund CapitalG are among investors pouring $1.9 billion into a truck hailing service platform Manbang  the Chinese company said in a statement on Tuesday.,normal
GOOG,Alphabet Inc,20180424,YouTube deletes 5 mln videos for content violation ,SAN FRANCISCO  April 24 YouTube  owned by Alphabet Inc's Google  deleted about 5 million videos from its platform for content policy violations in last year's fourth quarter before any viewers saw them  it said in a new report that highlighted its response to pressure to better police its online community.,normal
GOOG,Alphabet Inc,20180424,US STOCKS SNAPSHOT-Wall St lower as yields  Alphabet weighs ,April 24 U.S. stocks turned negative on Tuesday  weighed down by shares of Alphabet and 3M and as yield on the 10-year Treasury notes rose to 3 percent for the first time in more than four years.,normal
GOOG,Alphabet Inc,20180424,Ad sales surge at Google parent Alphabet  but so do costs ,SAN FRANCISCO Strong growth in ad sales on Google search and YouTube were not enough to offset a surge in costs at parent Alphabet Inc that shrank the first-quarter operating margin  leaving shares flat after hours on Monday. | Video ,normal
GOOG,Alphabet Inc,20180424,Softbank  Google join $1.9 bln investment in China truck-hailing firm ,BEIJING/SHANGHAI  April 24 Japan's Softbank Group and Alphabet Inc's venture capital fund CapitalG are among investors pouring $1.9 billion into a truck hailing service platform Manbang  the Chinese company said in a statement on Tuesday.,normal
GOOG,Alphabet Inc,20180424,PRESS DIGEST -Wall Street Journal - April 24 ,April 24 The following are the top stories in the Wall Street Journal. Reuters has not verified these stories and does not vouch for their accuracy.,normal
GOOG,Alphabet Inc,20180423,BRIEF-Alphabet CFO Says Sites TAC To Continue To Increase As Percentage Of Sites Revenue  But Pace Of Y/Y Increase To Slow Starting Q2 ,* ALPHABET CFO - AT WAYMO  ACHIEVED 5 MILLION MILES OF DRIVING ON CITY STREETS  ADDING THE LATEST MILLION IN JUST 3 MONTHS - CONF CALL,topStory
GOOG,Alphabet Inc,20180423,BRIEF-Alphabet Inc Reports Q1 Earnings Per Share Of $13.33 ,* QUARTERLY TOTAL TRAFFIC ACQUISITION COSTS $6 288 MILLION VERSUS $4 629 MILLION REPORTED LAST YEAR,normal
GOOG,Alphabet Inc,20180423,Alphabet's profit jumps 73 percent in first quarter ,April 23 Alphabet Inc's profit jumped about 73 percent in the first three months of the year  as Google's parent company benefited from soaring sales of internet advertisements.,normal
GOOG,Alphabet Inc,20180417,ZTE may lose Android software license under U.S. order: source ,SAN FRANCISCO China's ZTE Corp  may not be able to use Google's Android operating system in its mobile devices because of a U.S. Commerce Department export control order  a source familiar with the matter said on Tuesday  adding that ZTE and the Alphabet Inc   unit have been discussing the impact of the order.,topStory
GOOG,Alphabet Inc,20180417,ZTE may lose Android software license under U.S. order -source ,SAN FRANCISCO  April 17 China's ZTE Corp may not be able to use Google's Android operating system in its mobile devices because of a U.S. Commerce Department export control order  a source familiar with the matter said on Tuesday  adding that ZTE and the Alphabet Inc unit have been discussing the impact of the order.,normal
GOOG,Alphabet Inc,20180412,Google poised to emerge unscathed from European antitrust crackdown ,BRUSSELS/SAN FRANCISCO The European Union's top antitrust regulator  Margrethe Vestager  has made it her mission to stem alleged anti-competitive abuses by big American tech companies  threatening as recently as last month to break up Alphabet Inc's Google.,topStory
GOOG,Alphabet Inc,20180412,INSIGHT-Google poised to emerge unscathed from European antitrust crackdown ,BRUSSELS/SAN FRANCISCO  April 12 The European Union's top antitrust regulator  Margrethe Vestager  has made it her mission to stem alleged anti-competitive abuses by big American tech companies  threatening as recently as last month to break up Alphabet Inc's Google.,normal
GOOG,Alphabet Inc,20180410,Google in talks to buy Nokia's airplane broadband business - Bloomberg ,April 10 Alphabet Inc's Google is in talks to buy Nokia Oyj's airplane broadband business  Bloomberg reported https://www.bloomberg.com/news/articles/2018-04-10/google-is-said-in-talks-to-buy-nokia-s-airborne-broadband-system on Tuesday  citing people familiar with the matter.,topStory
GOOG,Alphabet Inc,20180409,Alphabet unit to start Toronto smart-city tech pilot in summer  build in 2020 ,TORONTO Alphabet Inc's urban innovation company Sidewalk Labs hopes to break ground on its first ever smart-city project in Toronto in 2020  and begin testing some of the proposed technologies this summer  its chief executive told Reuters.,topStory
GOOG,Alphabet Inc,20180409,UPDATE 1-Alphabet unit to start Toronto smart-city tech pilot in summer  build in 2020 ,TORONTO  April 9 Alphabet Inc's urban innovation company Sidewalk Labs hopes to break ground on its first ever smart-city project in Toronto in 2020  and begin testing some of the proposed technologies this summer  its chief executive told Reuters.,normal
GOOG,Alphabet Inc,20180409,CORRECTED-Alphabet unit to start Toronto smart-city tech pilot in summer  build in 2020 ,TORONTO  April 9 Alphabet Inc's urban innovation company Sidewalk Labs hopes to break ground on its first ever smart-city project in Toronto in 2020  and begin testing some of the proposed technologies this summer  its chief executive told Reuters.,normal
GOOG,Alphabet Inc,20180409,Apple says all its facilities now powered by clean energy ,April 9 Apple Inc on Monday said it had achieved its goal of powering all of the company's facilities with renewable energy  a milestone that includes all of its data centers  offices and retail stores in 43 countries.,normal
GOOG,Alphabet Inc,20180408,Investors not giving Alphabet enough credit for growth outlook: Barron's ,NEW YORK Investors are not giving Alphabet Inc  sufficient credit for its growth outlook and franchise value  as the tech company could see profits expand 15 to 20 percent annually over the next three years  Barron's said in an article on Sunday.,topStory
GOOG,Alphabet Inc,20180408,Investors not giving Alphabet enough credit for growth outlook -Barron's ,NEW YORK  April 8 Investors are not giving Alphabet Inc sufficient credit for its growth outlook and franchise value  as the tech company could see profits expand 15 to 20 percent annually over the next three years  Barron's said in an article on Sunday.,normal
GOOG,Alphabet Inc,20180402,BRIEF-Alphabet Says To Transition Network Rev Metrics To Pct Change In Impressions & Cost-Per Impression In Q1 ,* IN Q1  TO TRANSITION NETWORK REV METRICS FROM PCT CHANGE IN PAID CLICKS & COST-PER-CLICK TO PCT CHANGE IN IMPRESSIONS & COST-PER IMPRESSION,topStory
GOOG,Alphabet Inc,20180329,Poor first quarter ends on a high note as stocks leap ,NEW YORK Stocks steadied on Thursday  after a woeful week for major technology companies  even as global equities careened towards their first quarterly drop in two years.,topStory
GOOG,Alphabet Inc,20180329,GLOBAL MARKETS-Poor first quarter ends on a high note as stocks leap ,NEW YORK  March 29 Stocks steadied on Thursday  after a woeful week for major technology companies  even as global equities careened towards their first quarterly drop in two years.,normal
GOOG,Alphabet Inc,20180329,US STOCKS-Wall St up more than 1 pct on last day of tumultuous quarter ,* Indexes up: Dow 1.06 pct  S&P 1.11 pct  Nasdaq 1.22 pct (Updates to early afternoon),normal
GOOG,Alphabet Inc,20180329,GLOBAL MARKETS-Stocks edge higher after tech woes  losses loom for first quarter ,NEW YORK  March 29 Riskier assets such as stocks steadied on Thursday  after a woeful week for giant technology companies  even as global equities careened towards their first quarterly drop in two years.,normal
