GOOG,Alphabet Inc,20170914,Uber  Waymo clash over key evidence in self-driving trial ,SAN FRANCISCO  Sept 14 Uber has asked a U.S. judge to exclude evidence from an upcoming trade-secrets trial about how a former engineer downloaded thousands of confidential files from Alphabet Inc's Waymo self-driving car unit before eventually joining Uber.,normal
GOOG,Alphabet Inc,20170913,Uber's bid to move Waymo court fight to arbitration denied by appeals court ,Uber Technology Inc's attempt to move its high-profile trade secrets dispute with Alphabet Inc's self-driving car unit Waymo to private arbitration was denied again by a U.S. federal appeals court on Wednesday.,topStory
GOOG,Alphabet Inc,20170913,Uber's bid to move Waymo court fight to arbitration denied by appeals court ,Uber Technology Inc's attempt to move its high-profile trade secrets dispute with Alphabet Inc's self-driving car unit Waymo to private arbitration was denied again by a U.S. federal appeals court on Wednesday.,normal
GOOG,Alphabet Inc,20170913,UPDATE 1-Uber's bid to move Waymo court fight to arbitration denied by appeals court ,Sept 13 Uber Technology Inc's attempt to move its high-profile trade secrets dispute with Alphabet Inc's self-driving car unit Waymo to private arbitration was denied again by a U.S. federal appeals court on Wednesday.,normal
GOOG,Alphabet Inc,20170907,Lyft to offer rides in self-driving cars in San Francisco area ,SAN FRANCISCO  Sept 7 A self-driving car will soon be one ride option available from  Lyft in the San Francisco Bay Area  as the ride-services company ramps up its efforts to become a serious player in autonomous vehicle technology.,normal
GOOG,Alphabet Inc,20170829,Alphabet's Google acts to comply with EU antitrust order ,BRUSSELS Google  has submitted details of how it plans to stop favoring its shopping service to comply with a European Union  antitrust order  EU regulators said on Tuesday.,topStory
GOOG,Alphabet Inc,20170829,UPDATE 2-Alphabet's Google acts to comply with EU antitrust order ,BRUSSELS  Aug 29 Google has submitted details of how it plans to stop favouring its shopping service to comply with a European Union  antitrust order  EU regulators said on Tuesday.,normal
GOOG,Alphabet Inc,20170828,UPDATE 1-Four Uber drivers fined in Denmark  others charged ,COPENHAGEN  Aug 28 Four Uber drivers were fined by a Danish court on Monday for operating taxis illegally while working for the ride hailing service before it withdrew from the market in April.,normal
GOOG,Alphabet Inc,20170825,BUZZ-BlackRock's largest mutual fund appears to warm to Google again ,** BlackRock Inc portfolio managers appear to have turned more optimistic on Alphabet Inc,topStory
GOOG,Alphabet Inc,20170814,U.S. hedge funds bearish on FAANG stocks in second-quarter: SEC filings ,NEW YORK Closely-watched U.S. hedge fund managers were generally bearish on the FAANG group of high-flying tech stocks in the second quarter  with eight such investors in aggregate cutting or liquidating 18 stakes in the companies  regulatory filings showed.,topStory
GOOG,Alphabet Inc,20170814,BRIEF-Tiger Global Management cuts stake in Amazon.com  Alphabet ,* Cuts share stake in Amazon.com Inc by 8.1 percent to 1.2 million shares - sec filing‍​,normal
GOOG,Alphabet Inc,20170811,BRIEF-Third Point ups share stake in Facebook  dissolves in Snap Inc ,* Third Point Llc dissolves share stake in Snap Inc - SEC Filing,topStory
GOOG,Alphabet Inc,20170811,Google cancels staff meeting over fears of online harassment ,Alphabet's Google canceled on Thursday a company-wide meeting scheduled to discuss the controversy over a memo opposing diversity policies  the company said  citing concerns about personal attacks on employees from far-right commentators.,normal
GOOG,Alphabet Inc,20170811,UPDATE 1-Google cancels staff meeting over fears of online harassment ,Aug 10 Alphabet's Google canceled on Thursday a company-wide meeting scheduled to discuss the controversy over a memo opposing diversity policies  the company said  citing concerns about personal attacks on employees from far-right commentators.,normal
GOOG,Alphabet Inc,20170811,Google cancels staff meeting over fears of online harassment ,Aug 10 Alphabet's Google on Thursday canceled a company-wide meeting scheduled to discuss the controversy over a memo opposing company diversity policies  citing concerns about attacks on employees from far-right internet commenters  according to an email from Google's chief executive that was obtained by tech news site Recode.,normal
GOOG,Alphabet Inc,20170810,UPDATE 2-Uber's Graves stepping down from full-time job  stays on board ,SAN FRANCISCO  Aug 10 Ride services company Uber Technologies Inc's head of operations  Ryan Graves  a long-time ally of former chief executive Travis Kalanick  is stepping down from his full-time job at the company  according to a copy of a letter from Graves seen by Reuters.,normal
GOOG,Alphabet Inc,20170808,Google fires employee behind anti-diversity memo ,Aug 7 Alphabet Inc's Google has fired an employee who wrote an internal memo that ascribed gender inequality in the technology industry to biological differences.,topStory
GOOG,Alphabet Inc,20170807,Omega's Cooperman tells CNBC his biggest position is Alphabet ,NEW YORK Hedge fund investor Leon Cooperman  the chief executive of Omega Advisors  told cable television network CNBC on Monday that his firm's biggest position was a bullish bet on Google parent Alphabet Inc.,topStory
GOOG,Alphabet Inc,20170807,Omega's Cooperman tells CNBC his biggest position is Alphabet ,NEW YORK  Aug 7 Hedge fund investor Leon Cooperman  the chief executive of Omega Advisors  told cable television network CNBC on Monday that his firm's biggest position was a bullish bet on Google parent Alphabet Inc.,normal
GOOG,Alphabet Inc,20170727,Google hopes to train 10 million people in Africa in online skills: CEO ,LAGOS Alphabet Inc's Google aims to train 10 million people in Africa in online skills over the next five years in an effort to make them more employable  its chief executive said on Thursday.,topStory
GOOG,Alphabet Inc,20170727,Facebook shares hit record high as mobile ad sales soar ,Facebook Inc's mobile advertising business grew by more than 50 percent in the second quarter  the company said in its earnings report on Wednesday  as the social network continued to establish itself as the venue of choice for an ever-growing array of online advertisers. | Video ,normal
GOOG,Alphabet Inc,20170727,UPDATE 4-Facebook shares hit record high as mobile ad sales soar ,July 26 Facebook Inc's mobile advertising business grew by more than 50 percent in the second quarter  the company said in its earnings report on Wednesday  as the social network continued to establish itself as the venue of choice for an ever-growing array of online advertisers.,normal
GOOG,Alphabet Inc,20170726,BRIEF-Alphabet's Google announces $50 mln initiative to help people prepare for the changing nature of work - Blog ,* Alphabet's Google announces a $50 million initiative to help people prepare for the changing nature of work - Blog,topStory
GOOG,Alphabet Inc,20170726,One year after IPO  Japanese chat app Line reports drop in user numbers ,TOKYO Japan's Line Corp said its number of monthly active users fell from the previous quarter  its first such decline  underscoring the messaging app operator's struggles to grow outside its home country since last year's high-profile IPO.,normal
GOOG,Alphabet Inc,20170726,UPDATE 2-One year after IPO  Japanese chat app Line reports drop in user numbers ,* Monthly active users fell by 2 mln from last qtr to 169 mln (Adds details of decline in average monthly users),normal
GOOG,Alphabet Inc,20170725,Google Canada head exits  company names interim head ,TORONTO Alphabet Inc said on Tuesday that the head of its Google Canada operations  Sam Sebastian  has left the company.,topStory
GOOG,Alphabet Inc,20170725,UPDATE 1-Google Canada head exits  company names interim head ,TORONTO  July 25 Alphabet Inc said on Tuesday that the head of its Google Canada operations  Sam Sebastian  has left the company.,normal
GOOG,Alphabet Inc,20170725,Adobe to pull plug on Flash  ending an era ,SAN FRANCISCO Adobe Systems Inc's Flash  a once-ubiquitous technology used to power most of the media content found online  will be retired at the end of 2020  the software company announced Tuesday.,normal
GOOG,Alphabet Inc,20170725,ADOBE SYSTEMS WILL END SUPPORT FOR WIDELY USED FLASH MULTIMEDIA SOFTWARE BY 2020 ,ADOBE SYSTEMS WILL END SUPPORT FOR WIDELY USED FLASH MULTIMEDIA SOFTWARE BY 2020,normal
GOOG,Alphabet Inc,20170725,Investors unhappy as Alphabet shells out more to drive traffic ,There are very few things that make Alphabet Inc's  investors unhappy. A rising TAC - the cost of driving traffic to its site - is one of them.,normal
GOOG,Alphabet Inc,20170725,US STOCKS-McDonald's  Caterpillar power S&P to record ,* Dow up 0.46 pct  S&P up 0.28 pct  Nasdaq down 0.21 pct (Updates to open),normal
GOOG,Alphabet Inc,20170725,Investors unhappy as Alphabet shells out more to drive traffic ,July 25 There are very few things that make Alphabet Inc's investors unhappy. A rising TAC - the cost of driving traffic to its site - is one of them.,normal
GOOG,Alphabet Inc,20170725,Alphabet adds to cash pile despite higher costs  antitrust fine ,SAN FRANCISCO Alphabet Inc reported a 21 percent jump in quarterly revenue on Monday  maintaining a growth rate that is rarely seen among companies its size and suggesting the big sales gains enjoyed recently by the other Internet firms are not done yet. | Video ,normal
GOOG,Alphabet Inc,20170725,UPDATE 4-Alphabet adds to cash pile despite higher costs  antitrust fine ,SAN FRANCISCO  July 24 Alphabet Inc reported a 21 percent jump in quarterly revenue on Monday  maintaining a growth rate that is rarely seen among companies its size and suggesting the big sales gains enjoyed recently by the other Internet firms are not done yet.,normal
GOOG,Alphabet Inc,20170724,BRIEF-Alphabet reports qtrly earnings per share of $5.01 ,* Qtrly earnings per share excluding European Commission fine was $8.90,topStory
GOOG,Alphabet Inc,20170724,BRIEF-Alphabet says Q2 aggregate paid clicks were up 52 pct ,* Quarterly earnings per share excluding European Commission fine of $8.90‍​,normal
GOOG,Alphabet Inc,20170724,Alphabet profit slumps on record $2.7 bln EU fine ,July 24 Alphabet Inc reported a 27.7 percent drop in quarterly profit as the company recorded a previously announced charge related to a record $2.7 billion fine imposed on its Google unit by the EU.,normal
GOOG,Alphabet Inc,20170724,BRIEF-Alphabet Inc Q2 results press release ,Please click on the link below for Alphabet Inc's quarterly earnings press release: Source text:,normal
GOOG,Alphabet Inc,20170724,BRIEF-Alphabet appoints Sundar Pichai to its board ,* Says ‍Pichai's appointment was effective July 19  2017​ Source text (http://bit.ly/2tU9lwf) Further company coverage:,normal
GOOG,Alphabet Inc,20170724,Alphabet appoints Google CEO Pichai to board ,Alphabet Inc said it appointed chief executive of its Google unit  Sundar Pichai  to its board.,normal
GOOG,Alphabet Inc,20170724,Alphabet appoints Google CEO Pichai to board ,July 24 Alphabet Inc said it appointed chief executive of its Google unit  Sundar Pichai  to its board.,normal
GOOG,Alphabet Inc,20170719,Google redesigns mobile search app with personalized 'feed' ,SAN FRANCISCO  July 19 Google on Wednesday announced an overhaul of its search app on mobile phones to include a personalized feed of links about hobbies  travel  sports and other topics  a move that puts the search company into more direct competition with social networks such as Facebook.,topStory
GOOG,Alphabet Inc,20170712,Google Earth to let users post stories  photos in coming years ,RIO DE JANEIRO Alphabet Inc  wants users to post millions of stories  video and photos on its Google Earth platform in the next few years  the program chief said on Tuesday at a launch event in Brazil for content focused on showcasing the Amazon rainforest.,topStory
GOOG,Alphabet Inc,20170712,China could field nearly half of new electric car models by 2020 - study ,DETROIT  July 12 Chinese automakers are on track to produce 49 of the 103 new electric car models that will be launched globally by 2020  as part of China's push to accelerate the switch to battery power from oil  according to a new forecast released on Wednesday.,normal
GOOG,Alphabet Inc,20170707,Waymo must disclose details of Lyft car deal to Uber -ruling ,SAN FRANCISCO A U.S. judge on Friday ruled that Alphabet Inc's self-driving car unit Waymo must disclose documents to attorneys representing Uber Technologies Inc about Waymo's partnership with Lyft Inc  saying the information could be important in Waymo's lawsuit accusing Uber of stealing some of its trade secrets.,topStory
GOOG,Alphabet Inc,20170707,Facebook to build housing in Silicon Valley for first time ,SAN FRANCISCO  July 7 The shortage of housing in California's Silicon Valley has gotten so severe that Facebook Inc on Friday proposed taking homebuilding into its own hands for the first time with a plan to construct 1 500 units near its headquarters.,normal
GOOG,Alphabet Inc,20170707,Waymo must disclose details of Lyft car deal to Uber: ruling ,SAN FRANCISCO A U.S. judge on Friday ruled that Alphabet Inc's self-driving car unit Waymo must disclose documents to attorneys representing Uber Technologies Inc [UBER.UL] about Waymo's partnership with Lyft Inc  saying the information could be important in Waymo's lawsuit accusing Uber of stealing some of its trade secrets.,normal
GOOG,Alphabet Inc,20170707,Waymo must disclose details of Lyft car deal to Uber -ruling ,SAN FRANCISCO  July 7 A U.S. judge on Friday ruled that Alphabet Inc's self-driving car unit Waymo must disclose documents to attorneys representing Uber Technologies Inc about Waymo's partnership with Lyft Inc  saying the information could be important in Waymo's lawsuit accusing Uber of stealing some of its trade secrets.,normal
GOOG,Alphabet Inc,20170707,Google says its service disruption issue resolved ,Some of Alphabet Inc's Google services including  Admin Console  Calendar and Hangouts  suffered some service disruption on Thursday but the outages have now been resolved  according to Google service status page.,normal
GOOG,Alphabet Inc,20170707,Google says its Drive service facing disruption ,July 6 Alphabet Inc's Google Drive service is facing service disruption on Thursday  according to Google service status page.,normal
GOOG,Alphabet Inc,20170706,Alphabet spins out geothermal startup Dandelion ,Geothermal energy startup Dandelion has left Alphabet Inc's  moonshot accelerator X to become an independent company  Dandelion CEO Kathy Hannun said in a blog post on Thursday.,topStory
GOOG,Alphabet Inc,20170706,Alphabet spins out geothermal startup Dandelion ,July 6 Geothermal energy startup Dandelion has left Alphabet Inc's moonshot accelerator X to become an independent company  Dandelion CEO Kathy Hannun said in a blog post on Thursday.,normal
GOOG,Alphabet Inc,20170705,China's Baidu taps 50 partners to help advance self-driving ,DETROIT Baidu Inc  the top Chinese internet search firm  has formed a broad alliance to promote self-driving cars  pitting its Apollo platform against Alphabet Inc's system  it said on Wednesday  in hopes of getting the vehicles on the road in China by 2019.,topStory
GOOG,Alphabet Inc,20170705,China's Baidu taps 50 partners to help advance self-driving ,DETROIT  July 5 Baidu Inc  the top Chinese internet search firm  has formed a broad alliance to promote self-driving cars  pitting its Apollo platform against Alphabet Inc's system  it said on Wednesday  in hopes of getting the vehicles on the road in China by 2019.,normal
GOOG,Alphabet Inc,20170705,Google to start getting Norwegian wind power by September ,OSLO  July 5 Alphabet Inc's Google unit expects to receive its first wind power from Norway by early September  the company told Reuters on Wednesday.,normal
GOOG,Alphabet Inc,20170628,In EU dealings  Google could learn from an erstwhile rival ,BRUSSELS  June 28 (BRUSSELS) - Google's clash with EU antitrust enforcers has echoes of Microsoft's decade-long regulatory battle  a legacy that parent company Alphabet should bear in mind as it considers challenging the Commission  lawyers and fund managers said.,normal
GOOG,Alphabet Inc,20170628,Google faces years of EU oversight on top of record antitrust fine ,BRUSSELS/FRANKFURT Beyond a headline-grabbing 2.4 billion euro ($2.7 billion) fine EU antitrust regulators have levelled against Google  the internet giant is likely to be shackled for years by Tuesday's precedent-setting decision defining the company as a monopoly.,normal
GOOG,Alphabet Inc,20170628,REFILE-Google faces years of EU oversight on top of record antitrust fine ,BRUSSELS/FRANKFURT  June 27 Beyond a headline-grabbing 2.4 billion euro ($2.7 billion) fine EU antitrust regulators have levelled against Google  the internet giant is likely to be shackled for years by Tuesday's precedent-setting decision defining the company as a monopoly.,normal
GOOG,Alphabet Inc,20170627,BRIEF-Alphabet expects to accrue fine imposed by EC decision in Q2‍​ ,* Alphabet Inc on European Commission decision - "Will review the formal decision  but expects that it will accrue the fine in the second quarter of 2017"‍​ Source text: http://bit.ly/2ue64IF Further company coverage:,topStory
GOOG,Alphabet Inc,20170627,EU hits Google with record $2.7 bln fine ,BRUSSELS EU antitrust regulators hit Google with a record 2.4-billion-euro ($2.7 billion) fine for favouring its own shopping service  taking a tough line in the first of three probes of its dominance in searches and smartphone operating systems.,normal
GOOG,Alphabet Inc,20170627,EU fines Google record $2.7 billion in first antitrust case ,BRUSSELS EU antitrust regulators hit Alphabet  unit Google with a record 2.42-billion-euro ($2.7 billion) fine on Tuesday  taking a tough line in the first of three investigations into the company's dominance in searches and smartphones.,normal
GOOG,Alphabet Inc,20170627,Google says it is considering appeal against EU antitrust fine ,BRUSSELS Alphabet's  Google said on Tuesday it disagreed with the findings of EU antitrust regulators that it had abused its dominant position and was considering an appeal.,normal
GOOG,Alphabet Inc,20170627,EU antitrust regulators hit Google with record 2.42 bln euro fine ,BRUSSELS  June 27 EU antitrust regulators slapped a record 2.42-billion-euro ($2.7 billion) fine on Alphabet unit Google on Tuesday by illegally favouring its shopping service.,normal
GOOG,Alphabet Inc,20170626,Alphabet partners with Avis to manage self-driving car fleet ,June 26 Waymo  the self-driving car unit of Alphabet Inc  signed an agreement with Avis Budget Group Inc under which the U.S. car rental firm will manage its fleet of autonomous vehicles  the companies said on Monday.,topStory
GOOG,Alphabet Inc,20170623,Google to stop scanning Gmail for creating targeted ads ,Alphabet Inc's Google said on Friday it would stop scanning Gmail content for creating personalized ads from later this year  bringing the widely-used email service in line with its enterprise offering  G Suite.,topStory
GOOG,Alphabet Inc,20170623,Google to stop scanning Gmail for creating targeted ads ,June 23 Alphabet Inc's Google said on Friday it would stop scanning Gmail content for creating personalized ads from later this year  bringing the widely-used email service in line with its enterprise offering  G Suite.,normal
GOOG,Alphabet Inc,20170623,London startup Blockchain raises $40 million in fresh funding ,SAN FRANCISCO London-based startup Blockchain has raised $40 million (31.5 million pounds) in a fresh round of funding as the software company rides a wave of enthusiasm for digital currency technology.,normal
GOOG,Alphabet Inc,20170622,Uber CEO Travis Kalanick resigns under investor pressure ,SAN FRANCISCO Uber Technologies Inc Chief Executive Travis Kalanick  co-founder of one of the most influential technology companies of its generation  resigned on Tuesday under pressure from investors after a string of setbacks. | Video ,normal
GOOG,Alphabet Inc,20170622,UPDATE 9-Uber CEO Travis Kalanick resigns under investor pressure ,SAN FRANCISCO  June 21 Uber Technologies Inc Chief Executive Travis Kalanick  co-founder of one of the most influential technology companies of its generation  resigned on Tuesday under pressure from investors after a string of setbacks.,normal
GOOG,Alphabet Inc,20170619,Google tightens measures to remove extremist content on YouTube ,Alphabet Inc's  Google will implement more measures to identify and remove terrorist or violent extremist content on its video sharing platform YouTube  the company said in a blog post on Sunday.,topStory
GOOG,Alphabet Inc,20170619,Google tightens measures to remove extremist content on YouTube ,June 18 Alphabet Inc's Google will implement more measures to identify and remove terrorist or violent extremist content on its video sharing platform YouTube  the company said in a blog post on Sunday.,normal
GOOG,Alphabet Inc,20170615,Alphabet  Apple analyst research extends tech stock selloff ,NEW YORK  June 15 The U.S. technology sector fell on Thursday  pulled down by heavyweights including Apple Inc and Alphabet Inc after bearish analyst research gave investors a reason to take profits on the stock market's recent champion sector.,topStory
GOOG,Alphabet Inc,20170613,Waymo retires Firefly to focus on mass-produced vehicles ,Alphabet Inc's self-driving car unit Waymo said it is retiring its line of Firefly test vehicles to focus on integrating its technology into mass-produced vehicles.,topStory
GOOG,Alphabet Inc,20170613,Indonesia has reached tax deal with Google for 2016  finance minister  says ,JAKARTA Indonesia has reached a tax settlement with Alphabet Inc's Google for 2016  the country's finance minister said  following a months-long dispute over allegations that the search giant had not made enough annual payments to the government.,normal
GOOG,Alphabet Inc,20170613,Indonesia has reached tax deal with Google for 2016 -finmin ,JAKARTA  June 13 Indonesia has reached a settlement with Alphabet Inc's Google for 2016 in their dispute over taxes  the country's finance minister said on Tuesday.,normal
GOOG,Alphabet Inc,20170609,SoftBank to buy robotics businesses from Alphabet Inc ,TOKYO SoftBank Group Corp  said it would buy two firms that build walking robots from Google's parent company  Alphabet Inc   adding to the Japanese company's growing artificial intelligence portfolio.,topStory
GOOG,Alphabet Inc,20170609,UPDATE 3-SoftBank to buy robotics businesses from Alphabet Inc ,* Boston Dynamics  Schaft produce walking robots (Adds source comment on assets),normal
GOOG,Alphabet Inc,20170609,SoftBank unit agrees to buy Boston Dynamics from Alphabet Inc ,June 8 SoftBank Group Corp said on Thursday that a subsidiary of the company had agreed to buy robotics firm Boston Dynamics from Alphabet Inc.,normal
GOOG,Alphabet Inc,20170609,BRIEF-SoftBank announces agreement to acquire Boston Dynamics ,* Entered into a definitive agreement to acquire robotics pioneer Boston Dynamics from Alphabet Inc,normal
GOOG,Alphabet Inc,20170607,Judge rules Uber must disclose key document in Waymo self-driving car case ,SAN FRANCISCO A magistrate judge has ruled that Uber Technologies Inc must hand over a key document that could shed light on what its executives knew about alleged theft of trade secrets from Alphabet Inc's Waymo self-driving car unit.,topStory
GOOG,Alphabet Inc,20170607,Judge rules Uber must disclose key document in Waymo self-driving car case ,SAN FRANCISCO A magistrate judge has ruled that Uber Technologies Inc [UBER.UL] must hand over a key document that could shed light on what its executives knew about alleged theft of trade secrets from Alphabet Inc's  Waymo self-driving car unit.,normal
GOOG,Alphabet Inc,20170607,Judge rules Uber must disclose key document in Waymo self-driving car case ,SAN FRANCISCO  June 7 A magistrate judge has ruled that Uber Technologies Inc must hand over a key document that could shed light on what its executives knew about alleged theft of trade secrets from Alphabet Inc's Waymo self-driving car unit.,normal
GOOG,Alphabet Inc,20170607,UPDATE 1-Lack of power lines hits sub-Saharan Africa's biggest wind farm ,COPENHAGEN  June 7 The biggest wind farm in sub-Saharan Africa is ready for launch but will remain idle until next year as Kenya's government has not yet installed the transmission lines needed to get the clean power to customers  the provider of the turbines said.,normal
GOOG,Alphabet Inc,20170602,BRIEF-Alphabet Inc's ‍nest Labs and Ecobee announce long-term patent cross-license agreement​ ,* Alphabet Inc's ‍nest Labs and Ecobee announce long-term patent cross-license agreement​ Source text for Eikon: Further company coverage:,topStory
GOOG,Alphabet Inc,20170602,Waymo working on self-driving trucks ,Alphabet Inc's  self-driving car unit Waymo is working on developing self-driving trucks  the company said on Thursday.,normal
GOOG,Alphabet Inc,20170602,Waymo working on self-driving trucks ,June 1 Alphabet Inc's self-driving car unit Waymo is working on developing self-driving trucks  the company said on Thursday.,normal
GOOG,Alphabet Inc,20170601,Exclusive: Google faces hefty EU fine in shopping case by August - sources ,BRUSSELS EU antitrust regulators aim to slap a hefty fine on Alphabet  unit Google over its shopping service before the summer break in August  two people familiar with the matter said  setting the stage for two other cases involving the U.S. company.,topStory
